{
  "schemaVersion": 1,
  "revision": "2026-08-18T11:26:33Z",
  "generatedAt": "2026-08-18T11:26:33Z",
  "reference": {
    "path": "locales/en.json",
    "sha256": "5706efe891a4a1573858623ae373f8094979e31502e23ca0b99d1a258cfb22f0",
    "bytes": 43298,
    "keyCount": 643
  },
  "languages": [
    {
      "tag": "fi",
      "endonym": "Suomi",
      "path": "locales/fi.json",
      "sha256": "7619ca8e2df85ce391a9a84b23c9c49cbbec342c92da0cc6ec4c01e017098a42",
      "bytes": 47194,
      "keyCount": 643,
      "licence": "MIT"
    }
  ]
}
